{
  "$schema": "https://json-schema.org/draft/2020-12/schema",
  "$id": "https://cdn.jsdelivr.net/gh/walktalkmeditate/open-pilgrimages@v1/schema/way-report.schema.json",
  "title": "Pilgrimage Way Coverage Report",
  "description": "routes/<route-id>/ways/report.json — the honest picture of what a route can promise a walker.",
  "type": "object",
  "required": ["schemaVersion", "routeId", "generatedAt", "walkedLine", "stages", "gate", "dropped", "places"],
  "properties": {
    "schemaVersion": { "type": "string", "pattern": "^\\d+\\.\\d+\\.\\d+$" },
    "routeId": { "type": "string", "pattern": "^[a-z0-9-]{1,64}$" },
    "generatedAt": { "type": "string", "format": "date-time" },
    "walkedLine": {
      "type": "object",
      "required": ["source", "points", "lengthKm"],
      "properties": {
        "source": { "type": "string", "enum": ["route.main.geojson", "route.geojson"] },
        "points": { "type": "integer", "minimum": 2 },
        "lengthKm": { "type": "number", "exclusiveMinimum": 0 }
      },
      "additionalProperties": false
    },
    "stages": {
      "type": "array",
      "items": {
        "type": "object",
        "required": ["index", "name", "sliceKm", "distanceKm", "ratio", "passedGate", "boundaryMode", "routePoints", "moments", "momentsBeyondEnds", "momentsWithText", "marks", "marksTrimmed", "dropped"],
        "properties": {
          "index": { "type": "integer", "minimum": 0 },
          "name": { "type": "string" },
          "sliceKm": { "type": "number", "minimum": 0 },
          "distanceKm": { "type": "number", "minimum": 0 },
          "ratio": { "type": "number", "minimum": 0 },
          "passedGate": { "type": "boolean" },
          "boundaryMode": { "type": "string", "enum": ["snap", "proportional"] },
          "routePoints": { "type": "integer", "minimum": 0 },
          "moments": { "type": "integer", "minimum": 0 },
          "momentsBeyondEnds": { "type": "integer", "minimum": 0 },
          "momentsWithText": { "type": "integer", "minimum": 0 },
          "marks": { "type": "integer", "minimum": 0 },
          "marksTrimmed": { "type": "integer", "minimum": 0 },
          "dropped": { "type": "array", "items": { "type": "string" } }
        },
        "additionalProperties": false
      }
    },
    "gate": {
      "type": "object",
      "required": ["passed", "failing"],
      "properties": {
        "passed": { "type": "boolean" },
        "failing": { "type": "array", "items": { "type": "integer", "minimum": 0 } }
      },
      "additionalProperties": false
    },
    "dropped": {
      "description": "Waypoints of a moment type whose stageIndex is missing or outside 0..stages.length-1 — never assigned to any stage, so they never reach a stage's own dropped list.",
      "type": "array",
      "items": { "type": "string" }
    },
    "places": {
      "type": "object",
      "description": "How well curated the route is. Gates nothing: it becomes the sparse flag and placesPerStage on the catalog entry.",
      "required": ["sparse", "stagesWithMomentBeyondEnds", "halfOfStages", "placesPerStage"],
      "properties": {
        "sparse": { "type": "boolean" },
        "stagesWithMomentBeyondEnds": { "type": "integer", "minimum": 0 },
        "halfOfStages": { "type": "integer", "minimum": 0 },
        "placesPerStage": { "type": "number", "minimum": 0 },
        "note": { "type": "string" }
      },
      "additionalProperties": false
    }
  },
  "additionalProperties": false
}
