{
  "schemaVersion": "1.0.0",
  "routeId": "kumano-kodo-kohechi",
  "generatedAt": "2026-09-08T00:00:00Z",
  "walkedLine": {
    "source": "route.main.geojson",
    "points": 2986,
    "lengthKm": 64.327
  },
  "stages": [
    {
      "index": 0,
      "name": "Koyasan to Omata",
      "sliceKm": 16.69,
      "distanceKm": 16.7,
      "ratio": 0.9994,
      "passedGate": true,
      "boundaryMode": "snap",
      "routePoints": 201,
      "moments": 3,
      "momentsBeyondEnds": 1,
      "momentsWithText": 1,
      "marks": 4,
      "marksTrimmed": 0,
      "dropped": [
        "wp-osm-accommodation-node3696771536 (\"Hongakuin Temple\") is 572 m from the line, beyond the 300 m limit",
        "wp-osm-accommodation-node4198573943 (\"Jimyo-in Shukubo\") is 468 m from the line, beyond the 300 m limit",
        "wp-osm-accommodation-node4780805021 (\"Muryoko-in\") is 521 m from the line, beyond the 300 m limit",
        "wp-osm-accommodation-node5025094923 (\"Ichijo-in\") is 444 m from the line, beyond the 300 m limit",
        "wp-osm-accommodation-node5092538151 (\"Fumon-in\") is 463 m from the line, beyond the 300 m limit",
        "wp-osm-accommodation-node6852828607 (\"Fudo-in\") is 461 m from the line, beyond the 300 m limit",
        "wp-osm-food-node2722914025 (\"Café Hirugashi\") is 398 m from the line, beyond the 300 m limit",
        "wp-osm-food-node6412021145 (\"Chuoshokudo Sanbo 中央食堂 さんぼう\") is 378 m from the line, beyond the 300 m limit",
        "wp-osm-sacred_site-node5092538152 (\"Fugen-in\") is 399 m from the line, beyond the 300 m limit",
        "wp-osm-sacred_site-node5092538158 (\"Saimon-in\") is 328 m from the line, beyond the 300 m limit",
        "wp-osm-sacred_site-node5092538174 (\"Jofuku-in\") is 471 m from the line, beyond the 300 m limit",
        "wp-osm-transport-node1898351685 (\"6 Senjuinbashi E\") is 310 m from the line, beyond the 300 m limit",
        "wp-osm-transport-node1898351688 (\"15 Senjuinbashi W\") is 330 m from the line, beyond the 300 m limit",
        "wp-osm-transport-node1900629294 (\"7 Odawaradori\") is 355 m from the line, beyond the 300 m limit"
      ]
    },
    {
      "index": 1,
      "name": "Omata to Miura-guchi",
      "sliceKm": 13.145,
      "distanceKm": 13.1,
      "ratio": 1.0034,
      "passedGate": true,
      "boundaryMode": "snap",
      "routePoints": 184,
      "moments": 3,
      "momentsBeyondEnds": 1,
      "momentsWithText": 1,
      "marks": 2,
      "marksTrimmed": 0,
      "dropped": []
    },
    {
      "index": 2,
      "name": "Miura-guchi to Totsukawa Onsen",
      "sliceKm": 18.769,
      "distanceKm": 18.8,
      "ratio": 0.9983,
      "passedGate": true,
      "boundaryMode": "snap",
      "routePoints": 264,
      "moments": 2,
      "momentsBeyondEnds": 0,
      "momentsWithText": 0,
      "marks": 4,
      "marksTrimmed": 0,
      "dropped": []
    },
    {
      "index": 3,
      "name": "Totsukawa Onsen to Kumano Hongu Taisha",
      "sliceKm": 14.559,
      "distanceKm": 14.6,
      "ratio": 0.9972,
      "passedGate": true,
      "boundaryMode": "snap",
      "routePoints": 168,
      "moments": 3,
      "momentsBeyondEnds": 1,
      "momentsWithText": 1,
      "marks": 8,
      "marksTrimmed": 0,
      "dropped": []
    }
  ],
  "gate": {
    "passed": true,
    "failing": []
  },
  "dropped": [],
  "places": {
    "sparse": false,
    "stagesWithMomentBeyondEnds": 3,
    "halfOfStages": 2,
    "placesPerStage": 0.8
  }
}
