{
  "schemaVersion": "1.0.0",
  "routeId": "shikoku-88-tosa",
  "generatedAt": "2026-09-09T00:00:00Z",
  "walkedLine": {
    "source": "route.main.geojson",
    "points": 15280,
    "lengthKm": 418.501
  },
  "stages": [
    {
      "index": 0,
      "name": "Yakuō-ji (Temple 23) to Haryugetu Guesthouse",
      "sliceKm": 31.889,
      "distanceKm": 32.1,
      "ratio": 0.9934,
      "passedGate": true,
      "boundaryMode": "snap",
      "routePoints": 210,
      "moments": 3,
      "momentsBeyondEnds": 1,
      "momentsWithText": 1,
      "marks": 19,
      "marksTrimmed": 0,
      "dropped": []
    },
    {
      "index": 1,
      "name": "Haryugetu Guesthouse to Tokumasu Minshuku",
      "sliceKm": 30.691,
      "distanceKm": 30.8,
      "ratio": 0.9965,
      "passedGate": true,
      "boundaryMode": "snap",
      "routePoints": 195,
      "moments": 2,
      "momentsBeyondEnds": 0,
      "momentsWithText": 0,
      "marks": 34,
      "marksTrimmed": 0,
      "dropped": []
    },
    {
      "index": 2,
      "name": "Tokumasu Minshuku to Kongocho-ji (Temple 26)",
      "sliceKm": 25.106,
      "distanceKm": 25.2,
      "ratio": 0.9963,
      "passedGate": true,
      "boundaryMode": "snap",
      "routePoints": 163,
      "moments": 4,
      "momentsBeyondEnds": 2,
      "momentsWithText": 3,
      "marks": 53,
      "marksTrimmed": 0,
      "dropped": []
    },
    {
      "index": 3,
      "name": "Kongocho-ji (Temple 26) to Konomine-ji (Temple 27)",
      "sliceKm": 28.335,
      "distanceKm": 28.5,
      "ratio": 0.9942,
      "passedGate": true,
      "boundaryMode": "snap",
      "routePoints": 216,
      "moments": 3,
      "momentsBeyondEnds": 1,
      "momentsWithText": 2,
      "marks": 50,
      "marksTrimmed": 0,
      "dropped": []
    },
    {
      "index": 4,
      "name": "Konomine-ji (Temple 27) to 黒潮温泉ホテル",
      "sliceKm": 35.579,
      "distanceKm": 35.8,
      "ratio": 0.9938,
      "passedGate": true,
      "boundaryMode": "snap",
      "routePoints": 231,
      "moments": 4,
      "momentsBeyondEnds": 2,
      "momentsWithText": 2,
      "marks": 43,
      "marksTrimmed": 0,
      "dropped": [
        "wp-osm-transport-node8543216547 (\"Aki General Hospital\") is 312 m from the line, beyond the 300 m limit"
      ]
    },
    {
      "index": 5,
      "name": "黒潮温泉ホテル to Chikurin-ji (Temple 31)",
      "sliceKm": 25.166,
      "distanceKm": 25.4,
      "ratio": 0.9908,
      "passedGate": true,
      "boundaryMode": "snap",
      "routePoints": 202,
      "moments": 7,
      "momentsBeyondEnds": 5,
      "momentsWithText": 6,
      "marks": 20,
      "marksTrimmed": 0,
      "dropped": []
    },
    {
      "index": 6,
      "name": "Chikurin-ji (Temple 31) to Tosa",
      "sliceKm": 27.295,
      "distanceKm": 27.5,
      "ratio": 0.9926,
      "passedGate": true,
      "boundaryMode": "snap",
      "routePoints": 222,
      "moments": 5,
      "momentsBeyondEnds": 3,
      "momentsWithText": 3,
      "marks": 13,
      "marksTrimmed": 0,
      "dropped": []
    },
    {
      "index": 7,
      "name": "Tosa to Ohenro Guest House Lilian",
      "sliceKm": 20.916,
      "distanceKm": 21.1,
      "ratio": 0.9913,
      "passedGate": true,
      "boundaryMode": "snap",
      "routePoints": 189,
      "moments": 4,
      "momentsBeyondEnds": 2,
      "momentsWithText": 3,
      "marks": 2,
      "marksTrimmed": 0,
      "dropped": [
        "wp-osm-accommodation-node12897978736 (\"民泊汐風\") is 348 m from the line, beyond the 300 m limit"
      ]
    },
    {
      "index": 8,
      "name": "Ohenro Guest House Lilian to 民宿あわの里",
      "sliceKm": 26.31,
      "distanceKm": 26.6,
      "ratio": 0.9891,
      "passedGate": true,
      "boundaryMode": "snap",
      "routePoints": 254,
      "moments": 3,
      "momentsBeyondEnds": 1,
      "momentsWithText": 1,
      "marks": 5,
      "marksTrimmed": 0,
      "dropped": []
    },
    {
      "index": 9,
      "name": "民宿あわの里 to Iwamoto-ji (Temple 37)",
      "sliceKm": 27.698,
      "distanceKm": 27.9,
      "ratio": 0.9928,
      "passedGate": true,
      "boundaryMode": "snap",
      "routePoints": 250,
      "moments": 3,
      "momentsBeyondEnds": 1,
      "momentsWithText": 2,
      "marks": 18,
      "marksTrimmed": 0,
      "dropped": []
    },
    {
      "index": 10,
      "name": "Iwamoto-ji (Temple 37) to Henro House Maaru",
      "sliceKm": 27.982,
      "distanceKm": 28.2,
      "ratio": 0.9923,
      "passedGate": true,
      "boundaryMode": "snap",
      "routePoints": 243,
      "moments": 2,
      "momentsBeyondEnds": 0,
      "momentsWithText": 0,
      "marks": 16,
      "marksTrimmed": 0,
      "dropped": []
    },
    {
      "index": 11,
      "name": "Henro House Maaru to 民宿いさりび",
      "sliceKm": 33.44,
      "distanceKm": 33.6,
      "ratio": 0.9952,
      "passedGate": true,
      "boundaryMode": "snap",
      "routePoints": 208,
      "moments": 4,
      "momentsBeyondEnds": 2,
      "momentsWithText": 2,
      "marks": 10,
      "marksTrimmed": 0,
      "dropped": [
        "wp-osm-supply-node11377157869 (\"Unnamed\") is 331 m from the line, beyond the 300 m limit"
      ]
    },
    {
      "index": 12,
      "name": "民宿いさりび to 金剛福寺宿坊",
      "sliceKm": 20.718,
      "distanceKm": 20.9,
      "ratio": 0.9913,
      "passedGate": true,
      "boundaryMode": "snap",
      "routePoints": 201,
      "moments": 4,
      "momentsBeyondEnds": 2,
      "momentsWithText": 2,
      "marks": 12,
      "marksTrimmed": 0,
      "dropped": [
        "wp-osm-accommodation-node10819499568 (\"みかんの家\") is 1978 m from the line, beyond the 300 m limit",
        "wp-osm-food-node1498586696 (\"Sea Side Curry House\") is 1900 m from the line, beyond the 300 m limit",
        "wp-osm-medical-node1423730740 (\"修命会土佐清水病院\") is 1937 m from the line, beyond the 300 m limit",
        "wp-osm-medical-node1423744372 (\"足摺病院\") is 1843 m from the line, beyond the 300 m limit",
        "wp-osm-supply-node12019776285 (\"Lawson\") is 1751 m from the line, beyond the 300 m limit",
        "wp-osm-supply-node2569457699 (\"Unnamed\") is 2080 m from the line, beyond the 300 m limit"
      ]
    },
    {
      "index": 13,
      "name": "金剛福寺宿坊 to Ocean, River, Mountain Retreat",
      "sliceKm": 35.501,
      "distanceKm": 35.8,
      "ratio": 0.9916,
      "passedGate": true,
      "boundaryMode": "snap",
      "routePoints": 345,
      "moments": 3,
      "momentsBeyondEnds": 1,
      "momentsWithText": 1,
      "marks": 2,
      "marksTrimmed": 0,
      "dropped": [
        "wp-osm-accommodation-node11380474069 (\"Minshuku Tamura\") is 870 m from the line, beyond the 300 m limit",
        "wp-osm-accommodation-node4983997423 (\"足摺パシフィックホテル花椿\") is 1486 m from the line, beyond the 300 m limit",
        "wp-osm-accommodation-node5537156521 (\"Ashizuri Thermae\") is 1120 m from the line, beyond the 300 m limit"
      ]
    },
    {
      "index": 14,
      "name": "Ocean, River, Mountain Retreat to Enkō-ji (Temple 39)",
      "sliceKm": 19.049,
      "distanceKm": 19.2,
      "ratio": 0.9921,
      "passedGate": true,
      "boundaryMode": "snap",
      "routePoints": 163,
      "moments": 3,
      "momentsBeyondEnds": 1,
      "momentsWithText": 2,
      "marks": 7,
      "marksTrimmed": 0,
      "dropped": []
    }
  ],
  "gate": {
    "passed": true,
    "failing": []
  },
  "dropped": [],
  "places": {
    "sparse": false,
    "stagesWithMomentBeyondEnds": 13,
    "halfOfStages": 8,
    "placesPerStage": 1.6
  }
}
