{
  "schemaVersion": "1.0.0",
  "routeId": "shikoku-88-iyo",
  "generatedAt": "2026-09-09T00:00:00Z",
  "walkedLine": {
    "source": "route.main.geojson",
    "points": 13983,
    "lengthKm": 365.677
  },
  "stages": [
    {
      "index": 0,
      "name": "Enkō-ji (Temple 39) to Kanjizai-ji (Temple 40)",
      "sliceKm": 26.915,
      "distanceKm": 27.2,
      "ratio": 0.9895,
      "passedGate": true,
      "boundaryMode": "snap",
      "routePoints": 246,
      "moments": 5,
      "momentsBeyondEnds": 3,
      "momentsWithText": 3,
      "marks": 47,
      "marksTrimmed": 0,
      "dropped": []
    },
    {
      "index": 1,
      "name": "Kanjizai-ji (Temple 40) to Hotel Ailin",
      "sliceKm": 26.466,
      "distanceKm": 26.6,
      "ratio": 0.995,
      "passedGate": true,
      "boundaryMode": "snap",
      "routePoints": 243,
      "moments": 2,
      "momentsBeyondEnds": 0,
      "momentsWithText": 1,
      "marks": 34,
      "marksTrimmed": 0,
      "dropped": []
    },
    {
      "index": 2,
      "name": "Hotel Ailin to Butsumoku-ji (Temple 42)",
      "sliceKm": 25.943,
      "distanceKm": 26.1,
      "ratio": 0.994,
      "passedGate": true,
      "boundaryMode": "snap",
      "routePoints": 198,
      "moments": 4,
      "momentsBeyondEnds": 2,
      "momentsWithText": 3,
      "marks": 111,
      "marksTrimmed": 0,
      "dropped": []
    },
    {
      "index": 3,
      "name": "Butsumoku-ji (Temple 42) to Ozu",
      "sliceKm": 32.215,
      "distanceKm": 32.5,
      "ratio": 0.9912,
      "passedGate": true,
      "boundaryMode": "snap",
      "routePoints": 285,
      "moments": 4,
      "momentsBeyondEnds": 2,
      "momentsWithText": 3,
      "marks": 70,
      "marksTrimmed": 0,
      "dropped": []
    },
    {
      "index": 4,
      "name": "Ozu to Rairakuku",
      "sliceKm": 26.381,
      "distanceKm": 26.5,
      "ratio": 0.9955,
      "passedGate": true,
      "boundaryMode": "snap",
      "routePoints": 168,
      "moments": 3,
      "momentsBeyondEnds": 1,
      "momentsWithText": 1,
      "marks": 54,
      "marksTrimmed": 0,
      "dropped": [
        "wp-osm-transport-node3152605161 (\"大洲駅前\") is 301 m from the line, beyond the 300 m limit"
      ]
    },
    {
      "index": 5,
      "name": "Rairakuku to Karibaen",
      "sliceKm": 25.923,
      "distanceKm": 26.1,
      "ratio": 0.9932,
      "passedGate": true,
      "boundaryMode": "snap",
      "routePoints": 250,
      "moments": 3,
      "momentsBeyondEnds": 1,
      "momentsWithText": 1,
      "marks": 24,
      "marksTrimmed": 0,
      "dropped": []
    },
    {
      "index": 6,
      "name": "Karibaen to Ichiriki",
      "sliceKm": 17.318,
      "distanceKm": 17.5,
      "ratio": 0.9896,
      "passedGate": true,
      "boundaryMode": "snap",
      "routePoints": 160,
      "moments": 4,
      "momentsBeyondEnds": 2,
      "momentsWithText": 2,
      "marks": 13,
      "marksTrimmed": 0,
      "dropped": []
    },
    {
      "index": 7,
      "name": "Ichiriki to Ishite-ji (Temple 51)",
      "sliceKm": 27.627,
      "distanceKm": 27.9,
      "ratio": 0.9902,
      "passedGate": true,
      "boundaryMode": "snap",
      "routePoints": 242,
      "moments": 8,
      "momentsBeyondEnds": 6,
      "momentsWithText": 7,
      "marks": 67,
      "marksTrimmed": 0,
      "dropped": [
        "wp-osm-medical-node1423738628 (\"杏林会東明病院\") is 325 m from the line, beyond the 300 m limit"
      ]
    },
    {
      "index": 8,
      "name": "Ishite-ji (Temple 51) to Hōjō Suigun Youth Hostel",
      "sliceKm": 23.865,
      "distanceKm": 24,
      "ratio": 0.9944,
      "passedGate": true,
      "boundaryMode": "snap",
      "routePoints": 167,
      "moments": 4,
      "momentsBeyondEnds": 2,
      "momentsWithText": 2,
      "marks": 110,
      "marksTrimmed": 0,
      "dropped": [
        "wp-osm-transport-node3152610454 (\"道後姫塚\") is 309 m from the line, beyond the 300 m limit",
        "wp-osm-water_source-node5500182421 (\"Unnamed\") is 303 m from the line, beyond the 300 m limit"
      ]
    },
    {
      "index": 9,
      "name": "Hōjō Suigun Youth Hostel to Nankobo (Temple 55)",
      "sliceKm": 28.188,
      "distanceKm": 28.3,
      "ratio": 0.996,
      "passedGate": true,
      "boundaryMode": "snap",
      "routePoints": 191,
      "moments": 3,
      "momentsBeyondEnds": 1,
      "momentsWithText": 1,
      "marks": 69,
      "marksTrimmed": 0,
      "dropped": []
    },
    {
      "index": 10,
      "name": "Nankobo (Temple 55) to ゲストハウス BEKKU",
      "sliceKm": 31.462,
      "distanceKm": 31.6,
      "ratio": 0.9956,
      "passedGate": true,
      "boundaryMode": "snap",
      "routePoints": 213,
      "moments": 7,
      "momentsBeyondEnds": 5,
      "momentsWithText": 6,
      "marks": 73,
      "marksTrimmed": 0,
      "dropped": []
    },
    {
      "index": 11,
      "name": "ゲストハウス BEKKU to Maegami-ji (Temple 64)",
      "sliceKm": 25.457,
      "distanceKm": 25.7,
      "ratio": 0.9905,
      "passedGate": true,
      "boundaryMode": "snap",
      "routePoints": 222,
      "moments": 6,
      "momentsBeyondEnds": 4,
      "momentsWithText": 5,
      "marks": 23,
      "marksTrimmed": 0,
      "dropped": []
    },
    {
      "index": 12,
      "name": "Maegami-ji (Temple 64) to HOTEL AZ 愛媛土居インター店",
      "sliceKm": 32.616,
      "distanceKm": 32.8,
      "ratio": 0.9944,
      "passedGate": true,
      "boundaryMode": "snap",
      "routePoints": 217,
      "moments": 3,
      "momentsBeyondEnds": 1,
      "momentsWithText": 1,
      "marks": 78,
      "marksTrimmed": 0,
      "dropped": []
    },
    {
      "index": 13,
      "name": "HOTEL AZ 愛媛土居インター店 to Sankaku-ji (Temple 65)",
      "sliceKm": 12.966,
      "distanceKm": 13,
      "ratio": 0.9974,
      "passedGate": true,
      "boundaryMode": "snap",
      "routePoints": 114,
      "moments": 2,
      "momentsBeyondEnds": 0,
      "momentsWithText": 1,
      "marks": 16,
      "marksTrimmed": 0,
      "dropped": []
    }
  ],
  "gate": {
    "passed": true,
    "failing": []
  },
  "dropped": [],
  "places": {
    "sparse": false,
    "stagesWithMomentBeyondEnds": 12,
    "halfOfStages": 7,
    "placesPerStage": 2.1
  }
}
