{
  "schemaVersion": "1.0.0",
  "routeId": "shikoku-88-awa",
  "generatedAt": "2026-09-09T00:00:00Z",
  "walkedLine": {
    "source": "route.main.geojson",
    "points": 7054,
    "lengthKm": 154.482
  },
  "stages": [
    {
      "index": 0,
      "name": "Ryōzen-ji (Temple 1) to Kirihata-ji (Temple 10)",
      "sliceKm": 27.939,
      "distanceKm": 28.3,
      "ratio": 0.9872,
      "passedGate": true,
      "boundaryMode": "snap",
      "routePoints": 254,
      "moments": 13,
      "momentsBeyondEnds": 11,
      "momentsWithText": 13,
      "marks": 24,
      "marksTrimmed": 0,
      "dropped": []
    },
    {
      "index": 1,
      "name": "Kirihata-ji (Temple 10) to Sudachi-an",
      "sliceKm": 24.002,
      "distanceKm": 24.3,
      "ratio": 0.9877,
      "passedGate": true,
      "boundaryMode": "snap",
      "routePoints": 237,
      "moments": 4,
      "momentsBeyondEnds": 2,
      "momentsWithText": 2,
      "marks": 11,
      "marksTrimmed": 0,
      "dropped": [
        "wp-osm-supply-node6992537152 (\"7-Eleven\") is 501 m from the line, beyond the 300 m limit",
        "wp-osm-transport-node13967883982 (\"鴨島営業所\") is 346 m from the line, beyond the 300 m limit"
      ]
    },
    {
      "index": 2,
      "name": "Sudachi-an to Ido-ji (Temple 17)",
      "sliceKm": 26.635,
      "distanceKm": 26.9,
      "ratio": 0.9902,
      "passedGate": true,
      "boundaryMode": "snap",
      "routePoints": 259,
      "moments": 8,
      "momentsBeyondEnds": 6,
      "momentsWithText": 7,
      "marks": 28,
      "marksTrimmed": 0,
      "dropped": []
    },
    {
      "index": 3,
      "name": "Ido-ji (Temple 17) to GuestHouse & Cafe Green House",
      "sliceKm": 52.442,
      "distanceKm": 52.9,
      "ratio": 0.9913,
      "passedGate": true,
      "boundaryMode": "snap",
      "routePoints": 434,
      "moments": 7,
      "momentsBeyondEnds": 5,
      "momentsWithText": 5,
      "marks": 69,
      "marksTrimmed": 0,
      "dropped": [
        "wp-osm-medical-node12080105513 (\"ありす調剤薬局\") is 317 m from the line, beyond the 300 m limit",
        "wp-osm-supply-node11083754197 (\"Unnamed\") is 315 m from the line, beyond the 300 m limit"
      ]
    },
    {
      "index": 4,
      "name": "GuestHouse & Cafe Green House to Yakuō-ji (Temple 23)",
      "sliceKm": 21.836,
      "distanceKm": 22.1,
      "ratio": 0.9881,
      "passedGate": true,
      "boundaryMode": "snap",
      "routePoints": 250,
      "moments": 3,
      "momentsBeyondEnds": 1,
      "momentsWithText": 2,
      "marks": 10,
      "marksTrimmed": 0,
      "dropped": [
        "wp-osm-supply-node298725358 (\"Lawson\") is 554 m from the line, beyond the 300 m limit",
        "wp-osm-transport-node369987265 (\"Kitagawachi\") is 963 m from the line, beyond the 300 m limit"
      ]
    }
  ],
  "gate": {
    "passed": true,
    "failing": []
  },
  "dropped": [],
  "places": {
    "sparse": false,
    "stagesWithMomentBeyondEnds": 5,
    "halfOfStages": 3,
    "placesPerStage": 5
  }
}
