{
  "schemaVersion": "1.0.0",
  "routeId": "kumano-kodo-nakahechi",
  "generatedAt": "2026-09-08T00:00:00Z",
  "walkedLine": {
    "source": "route.main.geojson",
    "points": 1592,
    "lengthKm": 35.877
  },
  "stages": [
    {
      "index": 0,
      "name": "Takijiri-oji to Takahara",
      "sliceKm": 3.556,
      "distanceKm": 3.6,
      "ratio": 0.9877,
      "passedGate": true,
      "boundaryMode": "snap",
      "routePoints": 45,
      "moments": 3,
      "momentsBeyondEnds": 1,
      "momentsWithText": 2,
      "marks": 0,
      "marksTrimmed": 0,
      "dropped": [
        "wp-osm-transport-node5106701651 (\"Todo\") is 495 m from the line, beyond the 300 m limit",
        "wp-takahara (\"Takahara\") is 518 m from the line, beyond the 300 m limit"
      ]
    },
    {
      "index": 1,
      "name": "Takahara to Chikatsuyu-oji",
      "sliceKm": 9.022,
      "distanceKm": 9,
      "ratio": 1.0024,
      "passedGate": true,
      "boundaryMode": "snap",
      "routePoints": 119,
      "moments": 6,
      "momentsBeyondEnds": 3,
      "momentsWithText": 5,
      "marks": 6,
      "marksTrimmed": 0,
      "dropped": []
    },
    {
      "index": 2,
      "name": "Chikatsuyu-oji to Hosshinmon-oji",
      "sliceKm": 15.894,
      "distanceKm": 15.9,
      "ratio": 0.9996,
      "passedGate": true,
      "boundaryMode": "snap",
      "routePoints": 253,
      "moments": 5,
      "momentsBeyondEnds": 3,
      "momentsWithText": 4,
      "marks": 17,
      "marksTrimmed": 0,
      "dropped": [
        "wp-osm-transport-node5106701441 (\"Kodo Aruki-no-Sato Chikatsuyu\") is 495 m from the line, beyond the 300 m limit",
        "wp-osm-transport-node8397039517 (\"Kobiro-toge 小広峠\") is 313 m from the line, beyond the 300 m limit"
      ]
    },
    {
      "index": 3,
      "name": "Hosshinmon-oji to Kumano Hongu Taisha",
      "sliceKm": 6.786,
      "distanceKm": 7.5,
      "ratio": 0.9048,
      "passedGate": true,
      "boundaryMode": "snap",
      "routePoints": 87,
      "moments": 5,
      "momentsBeyondEnds": 3,
      "momentsWithText": 4,
      "marks": 11,
      "marksTrimmed": 0,
      "dropped": [
        "wp-osm-accommodation-node10892238599 (\"Ashita-no-Mori\") is 3011 m from the line, beyond the 300 m limit",
        "wp-osm-accommodation-node13093970001 (\"j hoppers\") is 1812 m from the line, beyond the 300 m limit",
        "wp-osm-accommodation-node5104405372 (\"Minshuku Sumiya\") is 2990 m from the line, beyond the 300 m limit",
        "wp-osm-accommodation-node6699996187 (\"民宿 立石\") is 2955 m from the line, beyond the 300 m limit",
        "wp-osm-accommodation-node6699999687 (\"Tabinoyado Shiba\") is 2979 m from the line, beyond the 300 m limit",
        "wp-osm-accommodation-node7366087985 (\"Lemon guest house\") is 409 m from the line, beyond the 300 m limit",
        "wp-osm-accommodation-node7595302589 (\"Lemon guest house\") is 466 m from the line, beyond the 300 m limit",
        "wp-osm-food-node10780183507 (\"Nachi Neboke-do\") is 22781 m from the line, beyond the 300 m limit",
        "wp-osm-food-node13715123396 (\"Bond Bento\") is 2268 m from the line, beyond the 300 m limit",
        "wp-osm-food-node4836368282 (\"Bistro Bonheur\") is 26358 m from the line, beyond the 300 m limit",
        "wp-osm-food-node5104407334 (\"Aimi\") is 2462 m from the line, beyond the 300 m limit",
        "wp-osm-food-node6842876887 (\"Cafe Pilina\") is 26323 m from the line, beyond the 300 m limit",
        "wp-osm-food-node9672933992 (\"Unnamed\") is 21848 m from the line, beyond the 300 m limit",
        "wp-osm-supply-node11279132687 (\"正八\") is 2344 m from the line, beyond the 300 m limit",
        "wp-osm-supply-node11568705160 (\"Unnamed\") is 2363 m from the line, beyond the 300 m limit",
        "wp-osm-supply-node11569251346 (\"Unnamed\") is 10849 m from the line, beyond the 300 m limit",
        "wp-osm-supply-node11842974308 (\"Unnamed\") is 15678 m from the line, beyond the 300 m limit",
        "wp-osm-supply-node13100087952 (\"Unnamed\") is 465 m from the line, beyond the 300 m limit",
        "wp-osm-supply-node13100107299 (\"Unnamed\") is 2863 m from the line, beyond the 300 m limit",
        "wp-osm-supply-node13100116299 (\"Unnamed\") is 2645 m from the line, beyond the 300 m limit",
        "wp-osm-supply-node2724708384 (\"Unnamed\") is 21445 m from the line, beyond the 300 m limit",
        "wp-osm-supply-node2724708392 (\"Unnamed\") is 22489 m from the line, beyond the 300 m limit",
        "wp-osm-supply-node2822836598 (\"Unnamed\") is 1914 m from the line, beyond the 300 m limit",
        "wp-osm-supply-node3210797196 (\"Unnamed\") is 6434 m from the line, beyond the 300 m limit",
        "wp-osm-supply-node3212482194 (\"Unnamed\") is 10821 m from the line, beyond the 300 m limit",
        "wp-osm-supply-node3780418661 (\"Unnamed\") is 21453 m from the line, beyond the 300 m limit",
        "wp-osm-supply-node3780423058 (\"Unnamed\") is 22408 m from the line, beyond the 300 m limit",
        "wp-osm-supply-node4384815766 (\"Unnamed\") is 2058 m from the line, beyond the 300 m limit",
        "wp-osm-supply-node4437427603 (\"LAWSON\") is 26498 m from the line, beyond the 300 m limit",
        "wp-osm-supply-node4836368277 (\"FamilyMart\") is 26640 m from the line, beyond the 300 m limit",
        "wp-osm-supply-node5104280650 (\"Unnamed\") is 11106 m from the line, beyond the 300 m limit",
        "wp-osm-supply-node5104319736 (\"Unnamed\") is 21515 m from the line, beyond the 300 m limit",
        "wp-osm-supply-node5106434843 (\"Unnamed\") is 635 m from the line, beyond the 300 m limit",
        "wp-osm-supply-node5385786693 (\"請川公衆トイレ\") is 2668 m from the line, beyond the 300 m limit",
        "wp-osm-supply-node6702256886 (\"Unnamed\") is 21736 m from the line, beyond the 300 m limit",
        "wp-osm-supply-node6702256888 (\"Unnamed\") is 21641 m from the line, beyond the 300 m limit",
        "wp-osm-supply-node6702287785 (\"Unnamed\") is 21803 m from the line, beyond the 300 m limit",
        "wp-osm-supply-node6710340586 (\"Unnamed\") is 21311 m from the line, beyond the 300 m limit",
        "wp-osm-supply-node7472496586 (\"Unnamed\") is 692 m from the line, beyond the 300 m limit",
        "wp-osm-transport-node3578364302 (\"Nachisan\") is 21937 m from the line, beyond the 300 m limit",
        "wp-osm-transport-node3584262360 (\"Nachi station\") is 26448 m from the line, beyond the 300 m limit",
        "wp-osm-transport-node4187376206 (\"Ukegawa\") is 2449 m from the line, beyond the 300 m limit",
        "wp-osm-transport-node4451596589 (\"Takijiri\") is 97 m from the section's walked line, 0.0 km along it, and stage 3 covers 29.0–35.9 km — its stageIndex names a stage that does not reach it, so the 22319 m is to a different stretch of the same line",
        "wp-osm-transport-node4456061991 (\"Iseki\") is 24833 m from the line, beyond the 300 m limit",
        "wp-osm-transport-node4456079489 (\"Kawaseki\") is 25782 m from the line, beyond the 300 m limit",
        "wp-osm-transport-node4456079589 (\"Amanomya\") is 26550 m from the line, beyond the 300 m limit",
        "wp-osm-transport-node4836059645 (\"Kumano Kodo\") is 21926 m from the line, beyond the 300 m limit",
        "wp-osm-transport-node4855716621 (\"Kawayu Onsen\") is 2997 m from the line, beyond the 300 m limit",
        "wp-osm-transport-node5104319955 (\"Shimojibashi\") is 2632 m from the line, beyond the 300 m limit",
        "wp-osm-transport-node5104407337 (\"Fujiyamae\") is 3003 m from the line, beyond the 300 m limit",
        "wp-osm-transport-node5104537590 (\"Watarase Onsen\") is 2666 m from the line, beyond the 300 m limit",
        "wp-osm-transport-node5106434162 (\"Kumanohongu\") is 714 m from the line, beyond the 300 m limit",
        "wp-osm-transport-node5114931423 (\"Koguchi Bus stop\") is 10968 m from the line, beyond the 300 m limit",
        "wp-osm-transport-node5284528820 (\"Shimoyunomine\") is 2459 m from the line, beyond the 300 m limit",
        "wp-osm-transport-node6411696146 (\"Unnamed\") is 308 m from the line, beyond the 300 m limit",
        "wp-osm-transport-node8316893332 (\"Daimonzaka\") is 22200 m from the line, beyond the 300 m limit",
        "wp-osm-water_source-node13105384222 (\"Unnamed\") is 3001 m from the line, beyond the 300 m limit",
        "wp-yunomine-oji (\"Yunomine-oji\") is 1873 m from the line, beyond the 300 m limit",
        "wp-yunomine-onsen (\"Yunomine Onsen\") is 1873 m from the line, beyond the 300 m limit"
      ]
    }
  ],
  "gate": {
    "passed": true,
    "failing": []
  },
  "dropped": [
    "wp-nachi-taisha (\"Kumano Nachi Taisha\") has no stageIndex and was dropped",
    "wp-nachi-falls (\"Nachi Falls\") has no stageIndex and was dropped",
    "wp-hayatama-taisha (\"Kumano Hayatama Taisha\") has no stageIndex and was dropped"
  ],
  "places": {
    "sparse": false,
    "stagesWithMomentBeyondEnds": 4,
    "halfOfStages": 2,
    "placesPerStage": 2.5
  }
}
