{
  "schemaVersion": "1.0.0",
  "routeId": "shikoku-88-sanuki",
  "generatedAt": "2026-09-09T00:00:00Z",
  "walkedLine": {
    "source": "route.main.geojson",
    "points": 9020,
    "lengthKm": 202.234
  },
  "stages": [
    {
      "index": 0,
      "name": "Sankaku-ji (Temple 65) to Fujikawa Ryokan",
      "sliceKm": 37.827,
      "distanceKm": 38.3,
      "ratio": 0.9876,
      "passedGate": true,
      "boundaryMode": "snap",
      "routePoints": 403,
      "moments": 6,
      "momentsBeyondEnds": 4,
      "momentsWithText": 4,
      "marks": 23,
      "marksTrimmed": 0,
      "dropped": []
    },
    {
      "index": 1,
      "name": "Fujikawa Ryokan to Konzo-ji (Temple 76)",
      "sliceKm": 29.102,
      "distanceKm": 29.3,
      "ratio": 0.9932,
      "passedGate": true,
      "boundaryMode": "snap",
      "routePoints": 223,
      "moments": 11,
      "momentsBeyondEnds": 9,
      "momentsWithText": 10,
      "marks": 55,
      "marksTrimmed": 0,
      "dropped": [
        "wp-osm-supply-node2358488810 (\"Unnamed\") is 302 m from the line, beyond the 300 m limit"
      ]
    },
    {
      "index": 2,
      "name": "Konzo-ji (Temple 76) to Sakaide",
      "sliceKm": 14.811,
      "distanceKm": 14.9,
      "ratio": 0.994,
      "passedGate": true,
      "boundaryMode": "snap",
      "routePoints": 71,
      "moments": 7,
      "momentsBeyondEnds": 5,
      "momentsWithText": 6,
      "marks": 77,
      "marksTrimmed": 0,
      "dropped": [
        "wp-osm-transport-node7825993173 (\"Utazu\") is 303 m from the line, beyond the 300 m limit"
      ]
    },
    {
      "index": 3,
      "name": "Sakaide to Sanuki",
      "sliceKm": 59.075,
      "distanceKm": 59.6,
      "ratio": 0.9912,
      "passedGate": true,
      "boundaryMode": "snap",
      "routePoints": 552,
      "moments": 10,
      "momentsBeyondEnds": 8,
      "momentsWithText": 9,
      "marks": 138,
      "marksTrimmed": 0,
      "dropped": [
        "wp-osm-supply-node4627855268 (\"Unnamed\") is 308 m from the line, beyond the 300 m limit"
      ]
    },
    {
      "index": 4,
      "name": "Sanuki to Okubo-ji (Temple 88)",
      "sliceKm": 20.17,
      "distanceKm": 20.3,
      "ratio": 0.9936,
      "passedGate": true,
      "boundaryMode": "snap",
      "routePoints": 184,
      "moments": 4,
      "momentsBeyondEnds": 2,
      "momentsWithText": 3,
      "marks": 25,
      "marksTrimmed": 0,
      "dropped": []
    },
    {
      "index": 5,
      "name": "Okubo-ji (Temple 88) to Ryōzen-ji (Temple 1)",
      "sliceKm": 39.39,
      "distanceKm": 39.8,
      "ratio": 0.9897,
      "passedGate": true,
      "boundaryMode": "snap",
      "routePoints": 413,
      "moments": 2,
      "momentsBeyondEnds": 0,
      "momentsWithText": 0,
      "marks": 6,
      "marksTrimmed": 0,
      "dropped": []
    }
  ],
  "gate": {
    "passed": true,
    "failing": []
  },
  "dropped": [],
  "places": {
    "sparse": false,
    "stagesWithMomentBeyondEnds": 5,
    "halfOfStages": 3,
    "placesPerStage": 4.7
  }
}
